Population,Intervention,Comparison,Outcome,Measure,Effect,CI Lower,CI Upper,Significant,Number of participants,Number of studies,Certainty of the evidence (GRADE),Reasons for GRADE if not High,Risk of bias,Imprecision,Inconsistency,Indirectness,Publication bias
Children and adolescents,Resin-based sealant applications on occlusal tooth surfaces of permanent molars,No sealant application,Dentine caries in permanent molars (2 years follow-up),OR,0.12,0.07,0.19,TRUE,1066,6,Moderate,"There was considerable heterogeneity in this estimate (I2 = 77% P = 0.0007) but all of the trials showed a statistically significant effect favouring sealants. All studies recruited children aged 5-10 years. Three studies conducted in areas with fluoridated water, two studies stated water was not fluoridated and the remaining one study did not report whether water supplies were fluoridated.",FALSE,FALSE,TRUE,TRUE,FALSE
Children and adolescents,Glass ionomer sealant applications on occlusal tooth surfaces of permanent molars,No sealant application,Caries as DFS increment in permanent molars (2 years follow-up),MD,-0.18,-0.39,0.03,FALSE,404,1,Very low,A single study at unclear risk of bias (no information on sequence generation or allocation concealment). Children aged 12-13 years at baseline. Study conducted in an area with naturally fluoridated water. Study published in 1995.,TRUE,TRUE,TRUE,TRUE,TRUE
Children and adolescents,"Glass ionomer sealant (including Fuji III, VII, IX, Ketac Silver, Ketacâ fil, Ketac Molar Easymix or Baseline)",Resin sealant,"Dentine caries in permanent molars (Follow up: 1, 2, 3, 4, 5 and 7 years)",NA,NA,NA,NA,NA,2939,15,Very low,"Inconsistent effect. There were differences in: comparisons, outcomes, outcome reporting times and background fluoride exposure including water fluoridation. Five trials at high risk of bias, four at unclear risk of bias, and six at low risk of bias (for the four key domains of allocation concealment, incomplete outcome data, selective reporting and baseline comparability of the groups). Trials published between 1993 and 2012.",TRUE,TRUE,TRUE,TRUE,TRUE
Children and adolescents,"Resin-modified glass ionomer sealant (Fuji II LC, Vitrebond or Vitremer)","Resin sealant (Helioseal, Tetric Flow, Fluoroshield or Concise White)","Dentine caries in permanent molars (Follow up: 1, 2 and 3 years)",NA,NA,NA,NA,NA,418,3,Very low,"Inconsistent effect. Different products, outcomes, outcome reporting times and age groups. Two trials at unclear risk of bias and one at low risk of bias (for the four key domains of allocation concealment, incomplete outcome data, selective reporting and baseline comparability of the groups). No information on background fluoride exposure or baseline caries prevalence. Trials published between 1996 and 2010.",TRUE,TRUE,TRUE,TRUE,TRUE
Children and adolescents,Polyacid-modified resin composite,Resin sealant,Dentine caries in permanent molars,NA,NA,NA,NA,NA,68,2,Very low,"Two trials, different products compared. One trial at high risk of bias and one at unclear risk of bias.Water not fluoridated in one study and no information on background fluoride in the other, age at baseline 6-13 years, no information on baseline caries prevalence.",TRUE,TRUE,TRUE,TRUE,TRUE
