Population,Intervention,Comparison,Outcome,Measure,Effect,CI Lower,CI Upper,Significant,Number of participants,Number of studies,Certainty of the evidence (GRADE),Reasons for GRADE if not High,Risk of bias,Imprecision,Inconsistency,Indirectness,Publication bias
children and adolescents,resin based fissure sealant applications on occlusal tooth surfaces of permanent first molars,fluoride varnish applications on occlusal tooth surfaces of permanent first molars,Dentine caries in permanent molars,OR,0.67,0.37,1.19,FALSE,1683,4,Very low,"Downgraded one level as studies at high risk of detection bias.
Downgraded one level due to severe heterogeneity (I2 = 84%).
Downgraded one level for imprecision.",TRUE,TRUE,TRUE,FALSE,FALSE
children and adolescents,resin based fissure sealant applications on occlusal tooth surfaces of permanent first molars,fluoride varnish applications on occlusal tooth surfaces of permanent first molars,Adverse effects,None reported,None reported,None reported,None reported,None reported,None reported,None reported,None reported,None reported,None reported,None reported,None reported,None reported,None reported
children and adolescents,glass ionomer or resin‐modified glass ionomer sealant applications on occlusal tooth surfaces of permanent first molars,fluoride varnish applications on occlusal tooth surfaces of permanent first molars,Dentine caries in permanent molars,NA,NA,NA,NA,NA,995,3,Very low,"Downgraded due to risk of bias, different designs and follow-up times",TRUE,TRUE,TRUE,TRUE,FALSE
children and adolescents,glass ionomer or resin‐modified glass ionomer sealant applications on occlusal tooth surfaces of permanent first molars,fluoride varnish applications on occlusal tooth surfaces of permanent first molars,Adverse effects,None reported,None reported,None reported,None reported,None reported,None reported,None reported,None reported,None reported,None reported,None reported,None reported,None reported,None reported
children and adolescents at school in Germany,resin based fissure sealant + fluoride varnish applications on occlusal tooth surfaces of permanent first molars,fluoride varnish applications to occlusal tooth surfaces of permanent first molars,Dentine caries in permanent molars,OR,0.3,0.17,0.55,TRUE,92,1,Very low,"Study conducted in the 1990s (Splieth 2001).
No information on caries incidence among control teeth without treatment. Baseline caries of the study population (children five to eight years of age): mean decayed, missing and filled permanent surfaces 0.2.
Downgraded three levels because a single study (92 analysed participants) was conducted as early as the 1990s without information on caries incidence among control teeth without treatment, and although the study was otherwise well conducted, lack of blinding to outcome measurement caused further uncertainty about results.",TRUE,TRUE,FALSE,TRUE,FALSE
children and adolescents at school in Germany,resin based fissure sealant + fluoride varnish applications on occlusal tooth surfaces of permanent first molars,fluoride varnish applications to occlusal tooth surfaces of permanent first molars,Dentine caries in permanent molars,None reported,None reported,None reported,None reported,None reported,None reported,None reported,None reported,None reported,None reported,None reported,None reported,None reported,None reported
